"","GOBPID","Pvalue","OddsRatio","ExpCount","Count","Size","Term"
"230","GO:2000561",0.0429214139019697,45.4824561403509,0.0433880399924543,1,2,"regulation of CD4-positive, alpha-beta T cell proliferation"
"231","GO:0030193",0.0429214139019697,45.4824561403509,0.0433880399924543,1,2,"regulation of blood coagulation"
"232","GO:0002228",0.0429214139019697,45.4824561403509,0.0433880399924543,1,2,"natural killer cell mediated immunity"
"233","GO:0002761",0.0429214139019697,45.4824561403509,0.0433880399924543,1,2,"regulation of myeloid leukocyte differentiation"
"234","GO:0002762",0.0429214139019697,45.4824561403509,0.0433880399924543,1,2,"negative regulation of myeloid leukocyte differentiation"
"235","GO:0002715",0.0429214139019697,45.4824561403509,0.0433880399924543,1,2,"regulation of natural killer cell mediated immunity"
"236","GO:0045048",0.0429214139019697,45.4824561403509,0.0433880399924543,1,2,"protein insertion into ER membrane"
"237","GO:0072574",0.0429214139019697,45.4824561403509,0.0433880399924543,1,2,"hepatocyte proliferation"
"238","GO:0072575",0.0429214139019697,45.4824561403509,0.0433880399924543,1,2,"epithelial cell proliferation involved in liver morphogenesis"
"239","GO:0072576",0.0429214139019697,45.4824561403509,0.0433880399924543,1,2,"liver morphogenesis"
"240","GO:0030579",0.0429214139019697,45.4824561403509,0.0433880399924543,1,2,"ubiquitin-dependent SMAD protein catabolic process"
"241","GO:0016036",0.0429214139019697,45.4824561403509,0.0433880399924543,1,2,"cellular response to phosphate starvation"
"242","GO:1903894",0.0429214139019697,45.4824561403509,0.0433880399924543,1,2,"regulation of IRE1-mediated unfolded protein response"
"243","GO:0035739",0.0429214139019697,45.4824561403509,0.0433880399924543,1,2,"CD4-positive, alpha-beta T cell proliferation"
"244","GO:1900046",0.0429214139019697,45.4824561403509,0.0433880399924543,1,2,"regulation of hemostasis"
"245","GO:0002637",0.0429214139019697,45.4824561403509,0.0433880399924543,1,2,"regulation of immunoglobulin production"
"246","GO:0002639",0.0429214139019697,45.4824561403509,0.0433880399924543,1,2,"positive regulation of immunoglobulin production"
"247","GO:1901142",0.0429214139019697,45.4824561403509,0.0433880399924543,1,2,"insulin metabolic process"
"248","GO:0044068",0.0429214139019697,45.4824561403509,0.0433880399924543,1,2,"modulation by symbiont of host cellular process"
"249","GO:0016338",0.0429214139019697,45.4824561403509,0.0433880399924543,1,2,"calcium-independent cell-cell adhesion via plasma membrane cell-adhesion molecules"
"250","GO:0034110",0.0429214139019697,45.4824561403509,0.0433880399924543,1,2,"regulation of homotypic cell-cell adhesion"
"251","GO:0044003",0.0429214139019697,45.4824561403509,0.0433880399924543,1,2,"modification by symbiont of host morphology or physiology"
"252","GO:0061045",0.0429214139019697,45.4824561403509,0.0433880399924543,1,2,"negative regulation of wound healing"
"253","GO:1990090",0.0429214139019697,45.4824561403509,0.0433880399924543,1,2,"cellular response to nerve growth factor stimulus"
"254","GO:1990089",0.0429214139019697,45.4824561403509,0.0433880399924543,1,2,"response to nerve growth factor"
"255","GO:0055071",0.0429214139019697,45.4824561403509,0.0433880399924543,1,2,"manganese ion homeostasis"
"256","GO:0045670",0.0429214139019697,45.4824561403509,0.0433880399924543,1,2,"regulation of osteoclast differentiation"
"257","GO:0045671",0.0429214139019697,45.4824561403509,0.0433880399924543,1,2,"negative regulation of osteoclast differentiation"
"258","GO:0045601",0.0429214139019697,45.4824561403509,0.0433880399924543,1,2,"regulation of endothelial cell differentiation"
"259","GO:1901998",0.0429214139019697,45.4824561403509,0.0433880399924543,1,2,"toxin transport"
"260","GO:0036037",0.0429214139019697,45.4824561403509,0.0433880399924543,1,2,"CD8-positive, alpha-beta T cell activation"
"261","GO:0051094",0.0438351968533163,2.47121864090282,2.58158837955103,6,119,"positive regulation of developmental process"
"262","GO:0016477",0.045054680374428,2.72780748663102,1.95246179966044,5,90,"cell migration"
"263","GO:0001568",0.0453003689564883,4.05882352941176,0.802678739860404,3,37,"blood vessel development"
"264","GO:0007006",0.0459254268885999,6.5385587863464,0.347104319939634,2,16,"mitochondrial membrane organization"
"265","GO:0008643",0.0459254268885999,6.5385587863464,0.347104319939634,2,16,"carbohydrate transport"
"266","GO:0034645",0.0482692581020858,1.45601937319462,25.0782871156386,33,1156,"cellular macromolecule biosynthetic process"
"267","GO:0009892",0.0498084269387214,1.85322802197802,6.31295981890209,11,291,"negative regulation of metabolic process"
